Training Progress: 100%|█████████████████████████████████████████████████████████████████████████████████████████████████████████████████████████████████████████████████████████████| 100000/100000 [19:21:11<00:00,  1.12s/it] 
📌 Checkpoint at 100000 steps:
    - Model: models\td3\best_model_100000.zip
    - Replay buffer: models\td3\replay_buffer_100000.pkl
    - Elapsed: 27927.39 sec
Training Progress: 100%|█████████████████████████████████████████████████████████████████████████████████████████████████████████████████████████████████████████████████████████████| 100000/100000 [19:21:11<00:00,  1.44it/s]

🕒 Training Time Summary:
    10000 steps: 2144.66 sec
    25000 steps: 5198.00 sec
    50000 steps: 14256.43 sec
    75000 steps: 20145.32 sec
    100000 steps: 27927.39 sec
    Total training time: 69671.95 sec
✅ Final model saved to models\td3\best_model.zip
✅ Final replay buffer saved to models\td3\best_model_replay_buffer.pkl
Deleted temporary model file: C:\Users\benva\AppData\Local\Temp\PendCart_1ccdf873.slx
Deleted: C:\Users\benva\OneDrive\Documents\MATLAB\full_wrap\PendCart_1ccdf873.slxc
 Training complete. Environment closed.

Training Progress: 100%|█████████████████████████████████████████████████████████████████████████████████████████████████████████████████████████████████████████████████████████████| 100000/100000 [19:04:43<00:00,  1.16s/it] 
📌 Checkpoint at 100000 steps:
    - Model: models\a2c\best_model_100000.zip
    - Replay buffer: models\a2c\replay_buffer_100000.pkl
    - Elapsed: 27664.96 sec
Training Progress: 100%|█████████████████████████████████████████████████████████████████████████████████████████████████████████████████████████████████████████████████████████████| 100000/100000 [19:04:43<00:00,  1.46it/s] 

🕒 Training Time Summary:
    10000 steps: 2104.02 sec
    25000 steps: 5037.82 sec
    50000 steps: 13992.02 sec
    75000 steps: 19884.57 sec
    100000 steps: 27664.96 sec
    Total training time: 68683.51 sec
✅ Final model saved to models\a2c\best_model.zip
Deleted temporary model file: C:\Users\benva\AppData\Local\Temp\PendCart_1b052c39.slx
Deleted: C:\Users\benva\OneDrive\Documents\MATLAB\full_wrap\PendCart_1b052c39.slxc
 Training complete. Environment closed.

Training Progress: 100%|█████████████████████████████████████████████████████████████████████████████████████████████████████████████████████████████████████████████████████████████| 100000/100000 [19:28:44<00:00,  1.05it/s] 
📌 Checkpoint at 100000 steps:
    - Model: models\sac\best_model_100000.zip
    - Replay buffer: models\sac\replay_buffer_100000.pkl
    - Elapsed: 27979.12 sec
Training Progress: 100%|█████████████████████████████████████████████████████████████████████████████████████████████████████████████████████████████████████████████████████████████| 100000/100000 [19:28:44<00:00,  1.43it/s]

🕒 Training Time Summary:
    10000 steps: 2222.91 sec
    25000 steps: 5259.61 sec
    50000 steps: 14381.64 sec
    75000 steps: 20281.25 sec
    100000 steps: 27979.12 sec
    Total training time: 70124.65 sec
✅ Final model saved to models\sac\best_model.zip
✅ Final replay buffer saved to models\sac\best_model_replay_buffer.pkl
Deleted temporary model file: C:\Users\benva\AppData\Local\Temp\PendCart_3c87517d.slx
Deleted: C:\Users\benva\OneDrive\Documents\MATLAB\full_wrap\PendCart_3c87517d.slxc
 Training complete. Environment closed.

Training Progress: 100%|█████████████████████████████████████████████████████████████████████████████████████████████████████████████████████████████████████████████████████████████| 100000/100000 [19:24:34<00:00,  1.04s/it] 
📌 Checkpoint at 100000 steps:
    - Model: models\ddpg\best_model_100000.zip
    - Replay buffer: models\ddpg\replay_buffer_100000.pkl
    - Elapsed: 27947.56 sec
Training Progress: 100%|█████████████████████████████████████████████████████████████████████████████████████████████████████████████████████████████████████████████████████████████| 100000/100000 [19:24:34<00:00,  1.43it/s]

🕒 Training Time Summary:
    10000 steps: 2171.71 sec
    25000 steps: 5207.38 sec
    50000 steps: 14329.59 sec
    75000 steps: 20217.92 sec
    100000 steps: 27947.56 sec
    Total training time: 69874.30 sec
✅ Final model saved to models\ddpg\best_model.zip
✅ Final replay buffer saved to models\ddpg\best_model_replay_buffer.pkl
Deleted temporary model file: C:\Users\benva\AppData\Local\Temp\PendCart_260b5349.slx
Deleted: C:\Users\benva\OneDrive\Documents\MATLAB\full_wrap\PendCart_260b5349.slxc
 Training complete. Environment closed.